{
  "$schema": "https://json-schema.org/draft/2020-12/schema",
  "$id": "https://resources.data.gov/dcat-us/3.0.0/definitions/userestriction",
  "title": "UseRestriction",
  "description": "A restriction on usage of another item",
  "type": "object",
  "properties": {
    "@id": {
      "type": "string",
      "format": "iri"
    },
    "@type": {
      "type": "string",
      "default": "UseRestriction"
    },
    "restrictionNote": {
      "title": "restriction note",
      "description": "Significant information pertaining to the use or reproduction of the data",
      "type": ["null", "string"]
    },
    "restrictionStatus": {
      "title": "restriction status",
      "description": "Indication of whether or not there are use restrictions on the archival materials",
      "$ref": "/dcat-us/3.0.0/definitions/concept"
    },
    "specificRestriction": {
      "title": "specific restriction",
      "description": "The specific NARA restriction associated with the use restriction",
      "anyOf": [
        {
          "type": "null",
          "title": "Null allowed when not required"
        },
        {
          "$ref": "/dcat-us/3.0.0/definitions/concept",
          "description": "inline description of the specific restriction"
        }
      ]
    }
  },
  "required": ["restrictionStatus"]
}
